{
  "inputs": {
    "code": 429
  },
  "run": {
    "dryRun": true,
    "durationMs": 0,
    "finishedAt": "<TIMESTAMP>",
    "parallel": false,
    "specPath": "examples/httpbin-get.arazzo.yaml",
    "startedAt": "<TIMESTAMP>",
    "status": "success",
    "timeoutMs": 300000,
    "workflowId": "status-check"
  },
  "schemaVersion": "trace.v1",
  "steps": [
    {
      "attempt": 1,
      "decision": {
        "path": "next"
      },
      "durationMs": 0,
      "kind": "http",
      "operationPath": "{$sourceDescriptions.httpbin.url}#/paths/~1status~1%7Bcode%7D/get",
      "request": {
        "method": "GET",
        "url": "https://httpbin.org/status/429"
      },
      "response": {
        "body": "{}",
        "bodyBytes": 2,
        "bodyPreview": "{}",
        "contentType": "json",
        "statusCode": 200
      },
      "seq": 1,
      "stepId": "check-status",
      "workflowId": "status-check"
    },
    {
      "attempt": 1,
      "decision": {
        "path": "next"
      },
      "durationMs": 0,
      "kind": "http",
      "operationPath": "{$sourceDescriptions.httpbin.url}#/paths/~1get/get",
      "request": {
        "method": "GET",
        "url": "https://httpbin.org/get"
      },
      "response": {
        "body": "{}",
        "bodyBytes": 2,
        "bodyPreview": "{}",
        "contentType": "json",
        "statusCode": 200
      },
      "seq": 2,
      "stepId": "handle-error",
      "workflowId": "status-check"
    }
  ],
  "tool": {
    "name": "arazzo",
    "version": "<TOOL_VERSION>"
  }
}
